<?xml version="1.0" encoding="UTF-8"?>
<!DOCTYPE clientes SYSTEM "clientes.dtd">
<clientes>
    <cliente>
        <nombre>Mercasa</nombre>
        <cif>5676443</cif>
        <preferente></preferente>
    </cliente>
    <cliente>
        <nombre>Acer SL</nombre>
        <cif>5121554</cif>
    </cliente>
</clientes>